{
  "schema_version": 1,
  "asset_set_id": "Operation-FileOperate-BatchOperationExcel-004",
  "source": {
    "provider": "huggingface_dataset",
    "repository": "leeLegendary/Parallel_benchmark",
    "revision": "13bf942dfab6f9d71f16f0958f1edd8b436c7afa",
    "base_path": "benchmark_dataset/086f42e6-d412-4a4b-9702-0ef374e38c2b",
    "license_status": "unverified"
  },
  "distribution_policy": "download_only",
  "files": [
    {
      "path": "store1.xlsx",
      "size": 9258,
      "sha256": "1a5a69985b303f96d18d29d73b2c47653f662403484a36b5761f5635d4153a70",
      "media_type": "application/vnd.openxmlformats-officedocument.spreadsheetml.sheet"
    },
    {
      "path": "store2.xlsx",
      "size": 9279,
      "sha256": "56a523840a796142562fde92b67ddcaac247652d23e7376bac40299781b03457",
      "media_type": "application/vnd.openxmlformats-officedocument.spreadsheetml.sheet"
    },
    {
      "path": "store3.xlsx",
      "size": 9211,
      "sha256": "5eb434afffc3ccf5d903802b77be409ad0dd4dea73e6a2c738ceee17d939adbf",
      "media_type": "application/vnd.openxmlformats-officedocument.spreadsheetml.sheet"
    },
    {
      "path": "store4.xlsx",
      "size": 9222,
      "sha256": "5e3590b023745ffbfe26293061cddd45de5b5657380439b010a37bd89e539f67",
      "media_type": "application/vnd.openxmlformats-officedocument.spreadsheetml.sheet"
    }
  ]
}
