{
  "schema_version": 1,
  "asset_set_id": "Operation-FileOperate-CombinationDocs-007",
  "source": {
    "provider": "huggingface_dataset",
    "repository": "leeLegendary/Parallel_benchmark",
    "revision": "13bf942dfab6f9d71f16f0958f1edd8b436c7afa",
    "base_path": "benchmark_dataset/eebc7ed2-5c7d-4df5-ab71-b53040167536",
    "license_status": "unverified"
  },
  "distribution_policy": "download_only",
  "files": [
    {
      "path": "Conference.pptx",
      "size": 38079,
      "sha256": "38877fc03a1c54f2a3066b347d0a09114c312ba0e63e545c85f520e7d76eef0a",
      "media_type": "application/vnd.openxmlformats-officedocument.presentationml.presentation"
    },
    {
      "path": "Eval_framework.docx",
      "size": 14364,
      "sha256": "737f13011a878a92740c8781d370dfbb3505509d8c0b1b770a5f974cea9e7f66",
      "media_type": "application/vnd.openxmlformats-officedocument.wordprocessingml.document"
    },
    {
      "path": "McDonald_finacial_report.docx",
      "size": 14351,
      "sha256": "df1a15647946cba883e00cb1d0228f075b5e12e6b5deb02acb9c4f79a931515b",
      "media_type": "application/vnd.openxmlformats-officedocument.wordprocessingml.document"
    },
    {
      "path": "McDonalds_Monthly_Data.xlsx",
      "size": 9545,
      "sha256": "abaf2d2622354d6c8a1cd6115cda4b1e5b82ccdcd01565d739e75aa606e750b9",
      "media_type": "application/vnd.openxmlformats-officedocument.spreadsheetml.sheet"
    },
    {
      "path": "McDonalds_powerpoint_report.pptx",
      "size": 39699,
      "sha256": "a96a98ecba8bf648fae8357c35d31197d1594c063130737dd098a9c3ac1c712d",
      "media_type": "application/vnd.openxmlformats-officedocument.presentationml.presentation"
    },
    {
      "path": "Presentation_Strategy.pptx",
      "size": 38013,
      "sha256": "e461cb2eb21edeb7f279b9643d304d6115820fca42d2d6bc146085cb631d98fc",
      "media_type": "application/vnd.openxmlformats-officedocument.presentationml.presentation"
    }
  ]
}
